"repo_url","description","languages","num_commits","first_commit_date","last_commit_date","num_contributors","contributor_usernames","agency","organization"
"https://github.com/NOAA-CO-OPS/Seasonal_High_Tide_Flooding_Prediction","NOAA Seasonal to Annual High Tide Flooding Model","MATLAB",51,"2021-06-07T18:22:06Z","2024-11-25T15:33:56Z",5,"karen-kavanaugh, greg-dusek, LindsayRAbrams, paigehovenga, johncallahan42","National Oceanic and Atmospheric Administration","NOAA-CO-OPS"
"https://github.com/NOAA-CO-OPS/NOS-OFS-Skill-Assessment-Code","Contains the skill assessment code used by NOAA's National Ocean Service (NOS) to validate NOS Operational Forecast Systems (OFSs).","Fortran, Shell, Visual Basic 6.0, C, Perl, Cuda, Mathematica, C++",5,"2022-03-25T00:17:22Z","2024-01-10T18:07:20Z",1,"CristinaUrizar","National Oceanic and Atmospheric Administration","NOAA-CO-OPS"
"https://github.com/NOAA-CO-OPS/Coastal_Hazards_Example_Notebooks",NA,"Jupyter Notebook, Python",75,"2022-04-14T18:21:59Z","2024-08-02T18:06:07Z",4,"Tjima, juliaengdahl, karen-kavanaugh, LindsayRAbrams","National Oceanic and Atmospheric Administration","NOAA-CO-OPS"
"https://github.com/NOAA-CO-OPS/CO-OPS-Tidal-Analysis-Datum-Calculator",NA,"Python",14,"2023-06-01T13:41:25Z","2023-07-25T14:52:32Z",3,"david-wolcott, Tjima, LindsayRAbrams","National Oceanic and Atmospheric Administration","NOAA-CO-OPS"
"https://github.com/NOAA-CO-OPS/Annual-High-Tide-Flooding-HTF-Outlook",NA,"Jupyter Notebook, Python",7,"2024-10-04T12:21:25Z","2024-11-21T18:11:28Z",2,"bailey-armos, Tjima","National Oceanic and Atmospheric Administration","NOAA-CO-OPS"
"https://github.com/NOAA-CO-OPS/NWLON_WebCOOS_Synchronizer","Tool to synchronize NOAA  CO-OPS water level data with WebCOOS or your own web-cameras and make time-synchronized visualizations.","Python, Dockerfile",71,"2024-10-16T13:45:54Z","2024-12-11T16:27:25Z",1,"conlin-matt","National Oceanic and Atmospheric Administration","NOAA-CO-OPS"
