"repo_url","description","languages","num_commits","first_commit_date","last_commit_date","num_contributors","contributor_usernames","agency","organization"
"https://github.com/NOAA-PMEL/EcoFOCI_Jupyter_Notebooks","EcoFOCI Jupyter/Ipython Notebooks","Jupyter Notebook, HTML, Python, AGS Script, TeX, Fortran",712,"2014-03-26T19:44:23Z","2023-02-01T15:59:53Z",2,"shaunwbell, sarahsdonohoe","National Oceanic and Atmospheric Administration","NOAA-PMEL"
"https://github.com/NOAA-PMEL/PyFerret","The PyFerret program and Python module from NOAA/PMEL","Fortran, Python, C, Shell, Makefile, C++, NASL, Assembly, Awk, Pascal, Forth, Max, Gnuplot, HTML",10085,"1997-07-23T20:11:42Z","2023-07-14T19:09:39Z",8,"karlmsmith, AnsleyManke, ACManke, karlmattsmith, seasage, MaPaw, EdwardBetts, ssgromov","National Oceanic and Atmospheric Administration","NOAA-PMEL"
"https://github.com/NOAA-PMEL/LAS","Live Access Server","Java, JavaScript, HTML, CSS, Perl, Shell, Makefile, XSLT",10154,"2007-07-23T16:05:05Z","2023-11-01T15:48:52Z",7,"noaaroland, AnsleyManke, karlmsmith, kevin-obrien, johncallahan42, seasage, eugeneburger","National Oceanic and Atmospheric Administration","NOAA-PMEL"
"https://github.com/NOAA-PMEL/nctr_public","NCTR_public",NA,9,"2016-01-11T02:18:15Z","2019-07-23T15:47:45Z",3,"TsunamiChris, karlmsmith, eugeneburger","National Oceanic and Atmospheric Administration","NOAA-PMEL"
"https://github.com/NOAA-PMEL/Ferret","The Ferret program from NOAA/PMEL","Fortran, Gnuplot, C, PostScript, HTML, Shell, Roff, Makefile, C++, PHP, M4, Objective-C, Assembly, Forth, NASL, Pascal, sed, Awk, Max, DIGITAL Command Language",8191,"1997-07-23T20:11:42Z","2020-12-14T19:08:18Z",6,"AnsleyManke, karlmsmith, karlmattsmith, MaPaw, ssgromov, seasage","National Oceanic and Atmospheric Administration","NOAA-PMEL"
"https://github.com/NOAA-PMEL/OAPDashboard","The Upload Dashbord for the Ocean Acidifiation Project","Java, Assembly, HTML, XSLT, CSS, PLpgSQL, Shell, Python",2337,"2013-08-05T09:53:48Z","2024-08-30T21:48:29Z",9,"lkamb, karlmattsmith, karlmsmith, squaregoldfish, eburgerwa, bitoverlord, roland36, ivashrestha, eugeneburger","National Oceanic and Atmospheric Administration","NOAA-PMEL"
"https://github.com/NOAA-PMEL/MetadataTransform","XSLTransforms for OA Metadata","XSLT, HTML",27,"2016-03-10T23:40:18Z","2021-07-16T16:31:30Z",1,"eugeneburger","National Oceanic and Atmospheric Administration","NOAA-PMEL"
"https://github.com/NOAA-PMEL/acrobat",NA,"Python",6,"2016-03-22T23:10:56Z","2016-09-01T21:54:41Z",2,"Kim-Martini, eugeneburger","National Oceanic and Atmospheric Administration","NOAA-PMEL"
"https://github.com/NOAA-PMEL/CatalogCleaner",NA,"Java",25,"2012-09-03T12:59:05Z","2019-07-23T14:53:40Z",3,"karlmsmith, noaaroland, squaregoldfish","National Oceanic and Atmospheric Administration","NOAA-PMEL"
"https://github.com/NOAA-PMEL/CatalogEvaluator",NA,"Groovy, CSS, Java, JavaScript",6,"2016-05-09T18:39:39Z","2019-07-23T14:54:40Z",1,"karlmsmith","National Oceanic and Atmospheric Administration","NOAA-PMEL"
"https://github.com/NOAA-PMEL/AtSeaPrograms","Collection of python programs for EcoFOCI atsea data","Python, OpenEdge ABL, Shell",96,"2016-07-22T16:17:04Z","2021-04-22T18:19:58Z",1,"shaunwbell","National Oceanic and Atmospheric Administration","NOAA-PMEL"
"https://github.com/NOAA-PMEL/OAPMetadataEditor","OAP Metadata Editor","Java, Groovy, XSLT, CSS, Shell, Batchfile, HTML, JavaScript",360,"2016-07-28T01:01:21Z","2024-10-29T16:31:07Z",5,"lkamb, bitoverlord, noaaroland, eugeneburger, karlmsmith","National Oceanic and Atmospheric Administration","NOAA-PMEL"
"https://github.com/NOAA-PMEL/foci_profile_to_dsg","Ferret scripts to write FOCI profile data DSG files",NA,10,"2016-08-08T20:52:33Z","2019-07-23T15:54:02Z",2,"eugeneburger, karlmsmith","National Oceanic and Atmospheric Administration","NOAA-PMEL"
"https://github.com/NOAA-PMEL/uafnciso",NA,"XSLT, Java",55,"2016-08-19T20:57:54Z","2022-01-28T21:46:33Z",3,"noaaroland, karlmsmith, rsignell-usgs","National Oceanic and Atmospheric Administration","NOAA-PMEL"
"https://github.com/NOAA-PMEL/EcoFOCI_PavlofMetaDB","Collection of tools to interface with metadatabase for EcoFOCI","Python, Shell",106,"2016-08-22T14:55:16Z","2022-10-24T22:53:48Z",2,"shaunwbell, dependabot[bot]","National Oceanic and Atmospheric Administration","NOAA-PMEL"
"https://github.com/NOAA-PMEL/ArcticHeatExperiment","Files for processing ArcticHeat data","Python, Shell",61,"2016-09-09T17:06:47Z","2018-03-01T23:01:22Z",1,"shaunwbell","National Oceanic and Atmospheric Administration","NOAA-PMEL"
"https://github.com/NOAA-PMEL/NOAA-PMEL.github.io","Org page","CSS, HTML, JavaScript",7,"2016-09-16T19:36:45Z","2016-09-17T06:55:08Z",1,"eugeneburger","National Oceanic and Atmospheric Administration","NOAA-PMEL"
"https://github.com/NOAA-PMEL/FerretDatasets","Standard datasets used by Ferret and PyFerret",NA,35,"2016-09-19T21:30:29Z","2020-06-10T18:42:18Z",2,"karlmsmith, AnsleyManke","National Oceanic and Atmospheric Administration","NOAA-PMEL"
"https://github.com/NOAA-PMEL/acf2cdf","Convert .acf files to netcdf","Java, HTML, Shell",5,"2016-12-21T18:56:25Z","2018-10-18T20:18:13Z",1,"derekcoffman","National Oceanic and Atmospheric Administration","NOAA-PMEL"
"https://github.com/NOAA-PMEL/EcoFOCI_AcrobatProcessing",NA,"Python, Shell",30,"2017-01-04T22:33:30Z","2018-06-22T17:44:59Z",1,"shaunwbell","National Oceanic and Atmospheric Administration","NOAA-PMEL"
"https://github.com/NOAA-PMEL/NewportAcoustic","Code from acoustic lab newport for LARA, RAOS, SG, more","C, Python, C++, Shell",247,"2017-01-12T18:06:35Z","2017-11-07T19:36:56Z",1,"brikahnoaa","National Oceanic and Atmospheric Administration","NOAA-PMEL"
"https://github.com/NOAA-PMEL/EcoFOCI_AtSea","Routines for CTD processing and other at sea functions","Python, Shell",210,"2017-01-26T17:24:41Z","2022-03-15T15:47:35Z",2,"shaunwbell, dependabot[bot]","National Oceanic and Atmospheric Administration","NOAA-PMEL"
"https://github.com/NOAA-PMEL/EcoFOCI_MooringAnalysis","Collection of tools for processing and evaluating EcoFOCI mooring data","Python, Shell, Jupyter Notebook, HTML, Makefile, CSS",435,"2017-01-26T17:55:02Z","2022-11-08T16:43:02Z",2,"shaunwbell, dependabot[bot]","National Oceanic and Atmospheric Administration","NOAA-PMEL"
"https://github.com/NOAA-PMEL/EcoFOCI_ArgosDataOps","EcoFOCI utilities for processing Argo service drifter data","Python, Shell",295,"2017-02-01T19:15:24Z","2025-03-17T14:42:00Z",3,"shaunwbell, dependabot[bot], NOAA-Strausz","National Oceanic and Atmospheric Administration","NOAA-PMEL"
"https://github.com/NOAA-PMEL/EcoFOCI_MasterCOD2Bongo","Process bongo data from seabird and add metainformation from MasterCOD database","C, Perl, Python",4,"2017-04-17T14:41:05Z","2019-07-23T15:56:22Z",2,"karlmsmith, shaunwbell","National Oceanic and Atmospheric Administration","NOAA-PMEL"
"https://github.com/NOAA-PMEL/EDD-SerialVisualizer","A program to visualize sensor or other streaming data from the serial port","Python",18,"2017-04-26T16:31:45Z","2017-11-03T14:46:24Z",1,"MCasari-PMEL","National Oceanic and Atmospheric Administration","NOAA-PMEL"
"https://github.com/NOAA-PMEL/Python_Users_Group","Collection of documents and notes for PMEL Python Users Group","Jupyter Notebook",15,"2017-05-17T13:25:47Z","2019-07-23T16:07:50Z",2,"shaunwbell, karlmsmith","National Oceanic and Atmospheric Administration","NOAA-PMEL"
"https://github.com/NOAA-PMEL/EDD-MApCO2","This repository houses all development efforts on the second generation Moored Autonomous PCO2 sensor started in 2017.",NA,3,"2017-08-16T20:32:52Z","2017-11-03T14:45:12Z",1,"MCasari-PMEL","National Oceanic and Atmospheric Administration","NOAA-PMEL"
"https://github.com/NOAA-PMEL/PMEL",NA,NA,3,"2017-11-01T20:47:32Z","2018-09-14T21:06:09Z",2,"karlmsmith, eugeneburger","National Oceanic and Atmospheric Administration","NOAA-PMEL"
"https://github.com/NOAA-PMEL/GHOrgSync","Python script/module to clone/pull repositories at a GitHub organization site to local repository directories","Python",12,"2017-11-01T23:32:01Z","2018-09-14T21:04:26Z",1,"karlmsmith","National Oceanic and Atmospheric Administration","NOAA-PMEL"
"https://github.com/NOAA-PMEL/EDD-CO2_ValveAutomation","Valve block automation for calibrating CO2 using multiple calibration gases","Python",17,"2017-11-03T14:13:19Z","2021-12-16T19:36:05Z",3,"AlexMTurpin, MCasari-PMEL, noahlawrence-slavas","National Oceanic and Atmospheric Administration","NOAA-PMEL"
"https://github.com/NOAA-PMEL/Floatlab","Argo float testing software development",NA,2,"2017-11-07T18:47:16Z","2017-11-07T18:48:56Z",1,"eugeneburger","National Oceanic and Atmospheric Administration","NOAA-PMEL"
"https://github.com/NOAA-PMEL/EcoFOCI_Configuration_Files","various configuration files for EcoFOCI routines and analysis",NA,4,"2017-11-16T22:27:27Z","2019-07-23T15:59:21Z",2,"karlmsmith, shaunwbell","National Oceanic and Atmospheric Administration","NOAA-PMEL"
"https://github.com/NOAA-PMEL/EDD-OSCompass_Test","A custom PCB and Python program to test eight Ocean Server OS4000-T digital compasses at a time","Python",53,"2017-11-17T00:25:34Z","2018-05-17T00:07:46Z",3,"ddevereaux, AlexMTurpin, MCasari-PMEL","National Oceanic and Atmospheric Administration","NOAA-PMEL"
"https://github.com/NOAA-PMEL/EcoFOCI_MTRDuino","Arduino Version of PMEL's MTR (Miniature Temperature Recorder)","C, HTML, C++, CSS, Makefile, Objective-C, Logos, Roff, Shell, Assembly, Processing, Java, Batchfile, Gnuplot",5,"2017-12-22T20:44:38Z","2018-11-15T20:19:03Z",2,"danielplangis, shaunwbell","National Oceanic and Atmospheric Administration","NOAA-PMEL"
"https://github.com/NOAA-PMEL/CO2_LicorTest_Automation","Licor and Valve Controller Automation","Python",19,"2018-01-23T20:22:05Z","2019-11-20T18:28:58Z",1,"MCasari-PMEL","National Oceanic and Atmospheric Administration","NOAA-PMEL"
"https://github.com/NOAA-PMEL/EcoFOCI_IPHC","IPHC profile data work","MATLAB",14,"2018-03-08T21:51:28Z","2020-04-17T21:40:26Z",2,"psullDat, karlmsmith","National Oceanic and Atmospheric Administration","NOAA-PMEL"
"https://github.com/NOAA-PMEL/las9-old","This is the home of latest LAS  (version 9).","Java, Groovy, CSS, JavaScript, TypeScript, HTML, Shell, Stata, Batchfile, SCSS",136,"2018-03-09T17:16:46Z","2022-01-25T19:48:40Z",2,"noaaroland, karlmsmith","National Oceanic and Atmospheric Administration","NOAA-PMEL"
"https://github.com/NOAA-PMEL/EcoFOCI_OculusGlider","Processing and Analysis routines for EcoFOCI related Glider Missions","Shell, Python",34,"2018-04-12T19:39:39Z","2020-08-24T23:10:40Z",2,"shaunwbell, karlmsmith","National Oceanic and Atmospheric Administration","NOAA-PMEL"
"https://github.com/NOAA-PMEL/EcoFOCI_Prawler","routines for processing and analyzing EcoFOCI related Prawler deployments","Python",21,"2018-05-16T16:01:36Z","2021-07-21T15:15:53Z",1,"shaunwbell","National Oceanic and Atmospheric Administration","NOAA-PMEL"
"https://github.com/NOAA-PMEL/EcoFOCI_eofs","Routines to do EOF analysis on EcoFOCI Data","Python",190,"2018-06-13T17:57:08Z","2025-03-17T13:47:18Z",2,"dependabot[bot], shaunwbell","National Oceanic and Atmospheric Administration","NOAA-PMEL"
"https://github.com/NOAA-PMEL/GTMBA-AtlasModuleConductivityScripts","Scripting some repeatable processes for conductivity calibations","Python, Perl, Shell",30,"2018-06-19T18:20:02Z","2024-05-02T05:53:26Z",1,"darynwhite","National Oceanic and Atmospheric Administration","NOAA-PMEL"
"https://github.com/NOAA-PMEL/EcoFOCI_PopUp","Documentation for EcoFOCI UnderIce PopUp Buoys","C, HTML, C++, Jupyter Notebook, Tcl, Roff, Rich Text Format, Makefile, CSS, Shell, Logos, Assembly, Objective-C, Processing, PostScript, R, Java, AGS Script, MATLAB, Batchfile, Perl, JavaScript, TeX, Gnuplot",73,"2018-10-01T16:39:36Z","2023-03-03T20:41:49Z",4,"shaunwbell, sarahsdonohoe, irisekmanis, danielplangis","National Oceanic and Atmospheric Administration","NOAA-PMEL"
"https://github.com/NOAA-PMEL/ooi","streamed data from OOI","IDL, Prolog, HTML, Jupyter Notebook, Python, Shell",56,"2018-10-09T18:02:43Z","2023-12-18T20:07:40Z",1,"brikahnoaa","National Oceanic and Atmospheric Administration","NOAA-PMEL"
"https://github.com/NOAA-PMEL/PMEL-training","GitHub training repo for PMEL",NA,75,"2018-10-12T21:08:07Z","2018-10-18T20:55:23Z",21,"MCasari-PMEL, eugeneburger, willazhu, JohnnyNoaa, sarahsdonohoe, achimhnicklis, dwdenbo52, ChrisMeinig, derekcoffman, JenniferKeene, lkamb, Luciamay, noaaroland, cadotc, jonkla, kenconnell, noahlawrence-slavas, pberk, psullDat, sophienchu, CathyCosca","National Oceanic and Atmospheric Administration","NOAA-PMEL"
"https://github.com/NOAA-PMEL/EcoFOCI_FieldOps_Documentation","Manuals, documentation and reference sheets for EcoFOCI Field Work","Jupyter Notebook, Python",636,"2018-10-18T20:10:40Z","2025-03-26T17:57:19Z",3,"shaunwbell, NOAA-Strausz, sarahsdonohoe","National Oceanic and Atmospheric Administration","NOAA-PMEL"
"https://github.com/NOAA-PMEL/ACG_Igor7Procs","Igor Pro 7 procedures used by NOAA/ACG","IGOR Pro",10,"2018-10-18T23:37:45Z","2018-10-22T21:17:44Z",1,"derekcoffman","National Oceanic and Atmospheric Administration","NOAA-PMEL"
"https://github.com/NOAA-PMEL/omega-trh-daq","DAQ to read/log Onion Omega2+ T and RH (and P) sensors","Python",5,"2018-10-23T18:07:14Z","2019-07-23T15:33:39Z",2,"derekcoffman, karlmsmith","National Oceanic and Atmospheric Administration","NOAA-PMEL"
"https://github.com/NOAA-PMEL/UAV-Arduino","UAV Arduino Data Card Code","C++",61,"2018-10-24T19:11:14Z","2021-06-21T22:40:21Z",2,"jimjohnsonnoaa, karlmsmith","National Oceanic and Atmospheric Administration","NOAA-PMEL"
"https://github.com/NOAA-PMEL/Admin_RAPTR","RAPTR Prototyping","Python, HTML, JavaScript, CSS",226,"2018-11-09T20:00:03Z","2022-03-01T20:50:35Z",2,"richard-parks, rparks63","National Oceanic and Atmospheric Administration","NOAA-PMEL"
"https://github.com/NOAA-PMEL/PMEL-Best-Practices","This is a collection of ""Best Practices"" pertaining to how PMEL operates; i.e. Software development, presentations, documentation, etc.",NA,25,"2018-11-13T04:06:43Z","2018-11-13T15:07:03Z",1,"MCasari-PMEL","National Oceanic and Atmospheric Administration","NOAA-PMEL"
"https://github.com/NOAA-PMEL/NewLinux","scripts and configs particular to newport linux","Shell, Python, C",4,"2019-02-20T22:50:05Z","2019-07-23T15:30:08Z",2,"brikahnoaa, karlmsmith","National Oceanic and Atmospheric Administration","NOAA-PMEL"
"https://github.com/NOAA-PMEL/OAPMetadata","OAP Metadata Definition and Bindings","XSLT, Java, Shell",38,"2019-03-06T00:44:32Z","2021-10-06T00:21:47Z",1,"lkamb","National Oceanic and Atmospheric Administration","NOAA-PMEL"
"https://github.com/NOAA-PMEL/envDataSystem","data acquisition system","Python, HTML, CSS, JavaScript, Dockerfile, Shell",350,"2019-06-13T17:50:04Z","2021-07-22T01:09:16Z",2,"derekcoffman, dependabot[bot]","National Oceanic and Atmospheric Administration","NOAA-PMEL"
"https://github.com/NOAA-PMEL/WRC-TUG","WRC Technology User Group Page",NA,60,"2019-08-06T19:52:19Z","2024-09-26T17:24:20Z",3,"noaaroland, darynwhite, MCasari-PMEL","National Oceanic and Atmospheric Administration","NOAA-PMEL"
"https://github.com/NOAA-PMEL/EDD-DepthSimulator",NA,"Python",6,"2019-10-23T15:56:10Z","2019-10-24T23:10:46Z",1,"MCasari-PMEL","National Oceanic and Atmospheric Administration","NOAA-PMEL"
"https://github.com/NOAA-PMEL/excel2oap",NA,"Java",36,"2019-11-26T17:13:46Z","2024-01-08T23:13:15Z",1,"lkamb","National Oceanic and Atmospheric Administration","NOAA-PMEL"
"https://github.com/NOAA-PMEL/Saildrone_templates","Templates used for data interchange from Saildrone platforms",NA,1,"2020-01-10T22:57:43Z","2020-01-10T22:57:43Z",1,"karlmsmith","National Oceanic and Atmospheric Administration","NOAA-PMEL"
"https://github.com/NOAA-PMEL/FastClean",NA,"Java",5,"2019-12-09T00:05:18Z","2019-12-09T02:30:10Z",1,"noaaroland","National Oceanic and Atmospheric Administration","NOAA-PMEL"
"https://github.com/NOAA-PMEL/pyacf2cdf","python version of acf2cdf","Python",15,"2020-04-21T21:54:59Z","2021-05-30T16:04:49Z",1,"derekcoffman","National Oceanic and Atmospheric Administration","NOAA-PMEL"
"https://github.com/NOAA-PMEL/Artemis_Global_Tracker","A global satellite tracker utilising the SparkFun Artemis module, Iridium 9603N satellite transceiver and u-blox ZOE-M8Q GNSS","C++, Python, C",86,"2019-10-10T14:25:07Z","2020-04-14T19:44:42Z",2,"PaulZC, nseidle","National Oceanic and Atmospheric Administration","NOAA-PMEL"
"https://github.com/NOAA-PMEL/EDD-LCP_Control","Control PCB & Firmware for Low Cost Profiler","C, Python, Makefile, Batchfile, PowerShell, Shell",373,"2020-05-19T13:35:14Z","2025-03-24T23:55:49Z",4,"BasharatNOAA, MCasari-PMEL, noahlawrence-slavas, jkurina86","National Oceanic and Atmospheric Administration","NOAA-PMEL"
"https://github.com/NOAA-PMEL/EDD-LCP_PistonDriver","Repository for LCP Piston Driver PCB design and firmware","C, Python, C++, Batchfile, PowerShell",123,"2020-05-19T13:45:59Z","2022-11-21T17:38:59Z",2,"MCasari-PMEL, AlexMTurpin","National Oceanic and Atmospheric Administration","NOAA-PMEL"
"https://github.com/NOAA-PMEL/osmc_dashboard","This is an implementation of a data dashboard for the Ocean Systems Monitoring System built on Holoviz.","Jupyter Notebook, CSS, Python, Shell",29,"2020-06-05T15:48:53Z","2020-08-25T14:32:36Z",3,"noaaroland, kevin-obrien, willirath","National Oceanic and Atmospheric Administration","NOAA-PMEL"
"https://github.com/NOAA-PMEL/SocatDashboard","The version of the SurfaceOceanCarbonAtlas/Dashboard repository used at NOAA/PMEL","Java, XSLT, CSS, HTML",1416,"2013-08-05T09:53:48Z","2023-04-04T20:49:56Z",8,"karlmattsmith, karlmsmith, squaregoldfish, eburgerwa, lkamb, roland36, ivashrestha, eugeneburger","National Oceanic and Atmospheric Administration","NOAA-PMEL"
"https://github.com/NOAA-PMEL/GTMBA-AtlasProcessingScripts","Simple scripts for use w/Atlas NextGen post-processing","Perl, Python, Shell",57,"2020-08-27T16:54:56Z","2024-07-19T21:38:43Z",3,"darynwhite, dependabot[bot], curranfey","National Oceanic and Atmospheric Administration","NOAA-PMEL"
"https://github.com/NOAA-PMEL/MemoryMap2Parsed","This program takes a memory map in an excel file and autogenerates a python method for parsing that block",NA,2,"2020-12-04T01:25:49Z","2020-12-04T01:30:49Z",1,"MCasari-PMEL","National Oceanic and Atmospheric Administration","NOAA-PMEL"
"https://github.com/NOAA-PMEL/EcoFOCI_AutoAnalysis","EcoFOCI Automated Tools",NA,1370,"2020-12-15T18:17:29Z","2025-03-27T18:43:56Z",2,"shaunwbell, dependabot[bot]","National Oceanic and Atmospheric Administration","NOAA-PMEL"
"https://github.com/NOAA-PMEL/ioos_qc",":ballot_box_with_check: :ocean: IOOS QARTOD and other Quality Control tests implemented in Python","Python, Shell",312,"2014-09-30T17:09:29Z","2020-12-23T15:38:27Z",8,"kwilcox, lukecampbell, benjwadams, ocefpaf, yosoyjay, Bobfrat, JoesephPaulSmith, sgfoote","National Oceanic and Atmospheric Administration","NOAA-PMEL"
"https://github.com/NOAA-PMEL/ACG_IgorProcs",NA,"IGOR Pro",12,"2021-01-29T22:02:26Z","2021-01-30T16:55:16Z",1,"derekcoffman","National Oceanic and Atmospheric Administration","NOAA-PMEL"
"https://github.com/NOAA-PMEL/EcoFOCI-Field-Internal-WebPages","Web Resources Framework for Internal EcoFOCI Records","PHP, HTML, CSS",110,"2021-03-06T01:26:12Z","2024-10-24T19:15:36Z",2,"shaunwbell, dependabot[bot]","National Oceanic and Atmospheric Administration","NOAA-PMEL"
"https://github.com/NOAA-PMEL/ARGO_PROCESSING","Code library to support processing and quality control of BGC Argo floats.","MATLAB, HTML, R",106,"2018-04-17T20:03:07Z","2021-09-20T23:17:03Z",3,"SOCCOM-BGCArgo, dnicholson, jplantmbari","National Oceanic and Atmospheric Administration","NOAA-PMEL"
"https://github.com/NOAA-PMEL/BGC_Argo_Mat_Toolbox","This toolbox contains a variety of functions for accessing, processing, and visualizing Biogeochemical Argo data. Functions are designed to be maximally efficient, to provide access to the most up-to-date data available, and to allow for downloading and plotting of those data based on numerous user-defined conditions.","MATLAB, HTML, CSS",172,"2021-06-09T20:21:39Z","2022-05-26T19:39:22Z",4,"hfrenzel-noaa, jonathansharp, ajfassbender, dnicholson","National Oceanic and Atmospheric Administration","NOAA-PMEL"
"https://github.com/NOAA-PMEL/EcoFOCIpy","python tools for the EcoFOCI PMEL research Program","Jupyter Notebook, Python",376,"2021-03-23T18:17:22Z","2025-02-20T21:43:57Z",3,"dependabot[bot], shaunwbell, JiaxuZ","National Oceanic and Atmospheric Administration","NOAA-PMEL"
"https://github.com/NOAA-PMEL/thePUG","PopUp GUI application for popup configuration files","Python",6,"2021-04-19T18:33:01Z","2022-06-13T15:42:12Z",1,"shjewellEDD","National Oceanic and Atmospheric Administration","NOAA-PMEL"
"https://github.com/NOAA-PMEL/QCaaS","Ocean data Quality Control as a Service prototype exploration project.","Roff, Java, Python, Shell, HTML",28,"2021-05-27T17:26:23Z","2023-11-29T00:27:00Z",1,"lkamb","National Oceanic and Atmospheric Administration","NOAA-PMEL"
"https://github.com/NOAA-PMEL/BGC_Argo_Mat_Profiles","Index and Sprof files for the GO-BGC workshop tutorial",NA,2,"2021-06-29T20:11:21Z","2021-06-29T20:16:37Z",1,"hfrenzel-noaa","National Oceanic and Atmospheric Administration","NOAA-PMEL"
"https://github.com/NOAA-PMEL/PopUp_kml_snailtrails","Downloads and decodes PopUp float data from rudics server.","Python",7,"2021-08-04T22:09:32Z","2022-09-30T21:52:38Z",1,"shjewellEDD","National Oceanic and Atmospheric Administration","NOAA-PMEL"
"https://github.com/NOAA-PMEL/envDS","envDataSystem reimagined","Python, HTML, CSS, Dockerfile, JavaScript",86,"2021-12-01T23:16:13Z","2024-11-14T23:05:48Z",1,"derekcoffman","National Oceanic and Atmospheric Administration","NOAA-PMEL"
"https://github.com/NOAA-PMEL/iot-data-landing","IoT Data Landing Project","Python, Shell, Dockerfile, Makefile",98,"2022-01-03T21:58:09Z","2023-08-15T20:25:08Z",3,"derekcoffman, aidan-axiom, kwilcox","National Oceanic and Atmospheric Administration","NOAA-PMEL"
"https://github.com/NOAA-PMEL/ecofoci_code_lab","Notebook demonstrations and examples","Jupyter Notebook",1135,"2016-05-10T20:45:17Z","2025-02-05T15:49:50Z",10,"ocefpaf, jbosch-noaa, lohithmunakala, shaunwbell, MathewBiddle, rsignell-usgs, sblockhartzzero, kwilcox, lsetiawan, mwengren","National Oceanic and Atmospheric Administration","NOAA-PMEL"
"https://github.com/NOAA-PMEL/gas_val_to_csv_for_ERDDAP",NA,"Python",11,"2022-01-24T20:46:08Z","2022-03-25T17:23:35Z",1,"pnespeca-PMEL","National Oceanic and Atmospheric Administration","NOAA-PMEL"
"https://github.com/NOAA-PMEL/las9","This is the home of LAS v9.x","Java, Groovy, CSS, TypeScript, JavaScript, HTML, Shell, Stata, Batchfile, SCSS",42,"2022-01-25T16:11:47Z","2023-11-01T15:46:09Z",2,"noaaroland, dependabot[bot]","National Oceanic and Atmospheric Administration","NOAA-PMEL"
"https://github.com/NOAA-PMEL/gas_val_post_processing",NA,"Python",14,"2022-02-17T22:29:32Z","2022-04-01T22:43:15Z",1,"pnespeca-PMEL","National Oceanic and Atmospheric Administration","NOAA-PMEL"
"https://github.com/NOAA-PMEL/testtesttest",NA,NA,NA,NA,NA,NA,NA,"National Oceanic and Atmospheric Administration","NOAA-PMEL"
"https://github.com/NOAA-PMEL/SaildroneCovarianceFlux","Python tools for calculating direct covariance fluxes from Saildrone high-frequency data","Python",6,"2022-04-25T20:11:19Z","2023-04-03T12:53:36Z",2,"JackReevesEyre-NOAA, JackReevesEyre","National Oceanic and Atmospheric Administration","NOAA-PMEL"
"https://github.com/NOAA-PMEL/OneArgo-Mat",NA,"MATLAB, HTML, CSS",215,"2021-06-09T20:21:39Z","2025-03-27T00:13:08Z",4,"hfrenzel-noaa, jonathansharp, ajfassbender, dnicholson","National Oceanic and Atmospheric Administration","NOAA-PMEL"
"https://github.com/NOAA-PMEL/OneArgo-R",NA,"R",69,"2021-06-11T13:59:39Z","2024-10-02T18:33:28Z",3,"mcornec, Yibin-Huang, hfrenzel-noaa","National Oceanic and Atmospheric Administration","NOAA-PMEL"
"https://github.com/NOAA-PMEL/sitedevelopment",NA,"HTML, CSS",3,"2022-06-14T06:51:22Z","2022-06-22T19:02:12Z",2,"colmanebashore, eugeneburger","National Oceanic and Atmospheric Administration","NOAA-PMEL"
"https://github.com/NOAA-PMEL/hurricanesite",NA,"HTML, CSS",13,"2022-06-24T06:37:00Z","2022-08-09T18:36:56Z",3,"colmanebashore, eugeneburger, Colman-Bashore","National Oceanic and Atmospheric Administration","NOAA-PMEL"
"https://github.com/NOAA-PMEL/YMCSite",NA,"HTML, CSS",11,"2022-06-24T07:56:48Z","2022-07-29T18:52:44Z",3,"colmanebashore, Colman-Bashore, eugeneburger","National Oceanic and Atmospheric Administration","NOAA-PMEL"
"https://github.com/NOAA-PMEL/counts","Python code to make a CSV file with monthly number of observations in a ERDDAP data set. ","Jupyter Notebook, Python",3,"2022-07-11T15:31:25Z","2022-07-11T15:48:24Z",1,"noaaroland","National Oceanic and Atmospheric Administration","NOAA-PMEL"
"https://github.com/NOAA-PMEL/lts","The OceanSITES Long-term Time Series Data Discovery Dashboard","Jupyter Notebook, Python, CSS, Procfile",59,"2022-07-11T15:52:19Z","2025-03-21T13:30:34Z",1,"noaaroland","National Oceanic and Atmospheric Administration","NOAA-PMEL"
"https://github.com/NOAA-PMEL/flux","Code for the OceanSITES Air Sea Fluxes Data Discovery Dashboard","Jupyter Notebook, Python, CSS, Procfile",27,"2022-07-12T13:06:23Z","2025-03-21T14:55:27Z",1,"noaaroland","National Oceanic and Atmospheric Administration","NOAA-PMEL"
"https://github.com/NOAA-PMEL/dashboard_saildrone","Plotly Dash dashboard which can display recent locations from a collection of different saildrone missions or a data from a single mission. ","Python, Jupyter Notebook, HTML, Shell, Procfile",150,"2022-07-12T14:37:43Z","2024-12-30T15:59:04Z",1,"noaaroland","National Oceanic and Atmospheric Administration","NOAA-PMEL"
"https://github.com/NOAA-PMEL/ftds","An implementation of the DatasetSource and IOSP for netCDF Java and TDS 5.x","Java",39,"2022-07-21T13:26:25Z","2022-11-28T17:47:11Z",1,"noaaroland","National Oceanic and Atmospheric Administration","NOAA-PMEL"
